{
  "$schema": "http://json-schema.org/draft-07/schema#",
  "$id": ".",
  "title": "Draconika Roll File",
  "description": "Roll table files for the Draconika DM tools.",
  "type": "object",
  "properties": {
    "version": {
      "description": "File version. Used to check for updates.",
      "type": "string"
    },
    "init": {
      "description": "Initial part to roll from the file.",
      "type": "string"
    },
    "name": {
      "description": "Display name of the file in the interface.",
      "type": "string"
    },
    "library": {
      "description": "Is this a library of tables rather than a generator to be displayed in the UI?",
      "type": "boolean"
    },
    "parts": {
      "description": "Data parts used to build the internal roll tables and generate the result.",
      "type": "object"
    }
  },
  "required": ["version", "init", "name"]
}
