{
  "$schema": "../schema/draconika-roll-file.json",
  "init": "race",
  "name": "Race Generator",
  "version": "0.1.0",
  "parts": {
    "race": [{
      "restrictions": {
        "setting": [ "azeroth" ],
        "faction": [ "alliance" ],
        "types": [ "humanoid" ]
      },
      "entries": [
        { "value": "Stormwind Human" },
        { "value": "Kul'tiran Human" },
        { "value": "Gilnean Human" },
        { "value": "High Elf" },
        { "value": "Night Elf" },
        { "value": "Void Elf" },
        { "value": "Exodar Draenei" },
        { "value": "Lightforged Draenei" },
        { "value": "Gnome" },
        { "value": "Ironforge Dwarf" },
        { "value": "Dark Iron Dwarf" },
        { "value": "Wildhammer Dwarf" }
      ]
    }, {
      "restrictions": {
        "setting": [ "azeroth" ],
        "faction": [ "horde" ],
        "types": [ "humanoid" ]
      },
      "entries": [
        { "value": "Blood Elf" },
        { "value": "Nightborne" },
        { "value": "Forsaken" },
        { "value": "Thunderbluff Taruen" },
        { "value": "Highmountain Tauren" },
        { "value": "Orc" },
        { "value": "Mag'har Orc" },
        { "value": "Darkspear Troll" },
        { "value": "Zandalari Troll" },
        { "value": "Goblin" }
      ]
    }, {
      "restrictions": {
        "setting": [ "azeroth" ],
        "faction": [ "horde", "alliance" ],
        "types": [ "humanoid" ]
      },
      "entries": [
        { "value": "Pandaren" }
      ]
    }, {
      "restrictions": {
        "setting": [ "azeroth" ],
        "types": [ "wild" ]
      },
      "entries": [
        { "value": "Mechagnome" },
        { "value": "Amani Troll" },
        { "value": "Gurubashi Troll" },
        { "value": "Naga" },
        { "value": "Vulpera" },
        { "value": "Furbolg" },
        { "value": "Owlkin" },
        { "value": "Ogre" }
      ]
    }, {
      "restrictions": {
        "setting": [ "azeroth" ],
        "types": [ "corrupted" ],
        "faction": [ "legion" ]
      },
      "entries": [
        { "value": "Sayaadi" },
        { "value": "Nathrezim" },
        { "value": "Shivarra" },
        { "value": "Eredar" }
      ]
    }, {
      "restrictions": {
        "setting": [ "forgotten realms"],
        "types": [ "humanoid" ]
      },
      "entries": [
        { "value": "Human", "chance": 10 },
        { "value": "High Elf", "chance": 5 },
        { "value": "Wood Elf", "chance": 5 },
        { "value": "Eladrin Elf" },
        { "value": "Hill Dwarf" , "chance": 4 },
        { "value": "Mountain Dwarf", "chance": 5 },
        { "value": "Stout Halfling", "chance": 5 },
        { "value": "Lightfoot Halfling", "chance": 5 },
        { "value": "Ghostwise Halfling" },
        { "value": "Forest Gnome", "chance": 2 },
        { "value": "Rock Gnome", "chance": 2 },
        { "value": "Deep Gnome" },
        { "value": "Half-orc", "chance": 3 },
        { "value": "Half-elf", "chance": 4 },
        { "value": "Dragonborn", "chance": 4 },
        { "value": "Infernal Tiefling", "chance": 2 },
        { "value": "Feral Tiefling", "chance": 2 },
        { "value": "Protector Aasimar", "chance": 2 },
        { "value": "Scourge Aasimar" },
        { "value": "Fallen Aasimar" },
        { "value": "Aarakocra", "chance": 3 },
        { "value": "Goliath", "chance": 4 },
        { "value": "Air Genasi" },
        { "value": "Earth Genasi" },
        { "value": "Fire Genasi" },
        { "value": "Water Genasi" },
        { "value": "Tabaxi", "chance": 3 },
        { "value": "Firbolg", "chance": 3 },
        { "value": "Triton", "chance": 3 },
        { "value": "Kenku", "chance": 3 },
        { "value": "Lizardfolk", "chance": 4 },
        { "value": "Duergar Dwarf" },
        { "value": "Drow" },
        { "value": "Kobold" },
        { "value": "Orc" },
        { "value": "Hobgoblin" },
        { "value": "Goblin" },
        { "value": "Bugbear" },
        { "value": "Yuan-Ti Pureblood" }
      ]
    }]
  }
}
