{
  "init": "format",
  "version": "1.0.1",
  "name": "D&D Gnome Name Library",
  "library": true,
  "parts": {
    "format": [{
      "restrictions": {
        "race": [ "gnome" ]
      },
      "entries": [
        { "value": "[firstName] [lastName]" }
      ]
    }],
    "firstName": [{
      "restrictions": {
        "gender": [ "female" ],
        "race": [ "gnome" ]
      },
      "entries": [
        { "value": "Abalaba" },
        { "value": "Bimpnottin" },
        { "value": "Breena" },
        { "value": "Buvvie" },
        { "value": "Callybon" },
        { "value": "Caramip" },
        { "value": "Carlin" },
        { "value": "Cumpen" },
        { "value": "Dalaba" },
        { "value": "Donella" },
        { "value": "Duvamil" },
        { "value": "Ella" },
        { "value": "Ellyjoybell" },
        { "value": "Ellywick" },
        { "value": "Enidda" },
        { "value": "Lilli" },
        { "value": "Loopmottin" },
        { "value": "Lorilla" },
        { "value": "Luthra" },
        { "value": "Mardnab" },
        { "value": "Meena" },
        { "value": "Menny" },
        { "value": "Mumpena" },
        { "value": "Nissa" },
        { "value": "Numba" },
        { "value": "Nyx" },
        { "value": "Oda" },
        { "value": "Oppah" },
        { "value": "Orla" },
        { "value": "Panana" },
        { "value": "Pyntle" },
        { "value": "Quilla" },
        { "value": "Ranala" },
        { "value": "Reddlepop" },
        { "value": "Roywyn" },
        { "value": "Salanop" },
        { "value": "Shamil" },
        { "value": "Siffress" },
        { "value": "Symma" },
        { "value": "Tana" },
        { "value": "Tenena" },
        { "value": "Tervaround" },
        { "value": "Tippletoe" },
        { "value": "Ulla" },
        { "value": "Unvera" },
        { "value": "Veloptima" },
        { "value": "Virra" },
        { "value": "Waywocket" },
        { "value": "Yebe" },
        { "value": "Zanna" }
      ]
    }, {
      "restrictions": {
        "gender": [ "male" ],
        "race": [ "gnome" ]
      },
      "entries": [
        { "value": "Alston" },
        { "value": "Alvyn" },
        { "value": "Anverth" },
        { "value": "Arumawann" },
        { "value": "Bilbron" },
        { "value": "Boddybock" },
        { "value": "Brocc" },
        { "value": "Burgell" },
        { "value": "Cockaby" },
        { "value": "Crampernap" },
        { "value": "Dabbledob" },
        { "value": "Delebean" },
        { "value": "Dimble" },
        { "value": "Eberdeb" },
        { "value": "Eldon" },
        { "value": "Erky" },
        { "value": "Fablen" },
        { "value": "Fibblestib" },
        { "value": "Fonkin" },
        { "value": "Frouse" },
        { "value": "Frug" },
        { "value": "Gerbo" },
        { "value": "Gimble" },
        { "value": "Glim" },
        { "value": "Igden" },
        { "value": "Jabble" },
        { "value": "Jebeddo" },
        { "value": "Kellen" },
        { "value": "Kipper" },
        { "value": "Namfoodle" },
        { "value": "Oppleby" },
        { "value": "Orryn" },
        { "value": "Paggen" },
        { "value": "Pallabar" },
        { "value": "Pog" },
        { "value": "Qualen" },
        { "value": "Ribbles" },
        { "value": "Rimple" },
        { "value": "Roondar" },
        { "value": "Sapply" },
        { "value": "Seebo" },
        { "value": "Senteq" },
        { "value": "Sindri" },
        { "value": "Umpen" },
        { "value": "Warryn" },
        { "value": "Wiggens" },
        { "value": "Wobbles" },
        { "value": "Wrenn" },
        { "value": "Zaffrab" },
        { "value": "Zook" }
      ]
    }],
    "lastName": [{
      "restrictions": {
        "race": [ "gnome" ]
      },
      "entries": [
        { "value": "Albaratie" },
        { "value": "Bafflestone" },
        { "value": "Beren" },
        { "value": "Boondiggles" },
        { "value": "Cobblelob" },
        { "value": "Daergel" },
        { "value": "Dunben" },
        { "value": "Fabblestabble" },
        { "value": "Fapplestamp" },
        { "value": "Fiddlefen" },
        { "value": "Folkor" },
        { "value": "Garrick" },
        { "value": "Gimlen" },
        { "value": "Glittergem" },
        { "value": "Gobblefirn" },
        { "value": "Gummen" },
        { "value": "Horcusporcus" },
        { "value": "Humplebumple" },
        { "value": "Ironhide" },
        { "value": "Leffery" },
        { "value": "Lingenhall" },
        { "value": "Loofollue" },
        { "value": "Maekkelferce" },
        { "value": "Miggledy" },
        { "value": "Munggen" },
        { "value": "Murnig" },
        { "value": "Musgraben" },
        { "value": "Nackle" },
        { "value": "Ningel" },
        { "value": "Nopenstallen" },
        { "value": "Nucklestamp" },
        { "value": "Offund" },
        { "value": "Oomtrowl" },
        { "value": "Pilwicken" },
        { "value": "Pingun" },
        { "value": "Quillsharpener" },
        { "value": "Raulner" },
        { "value": "Reese" },
        { "value": "Rofferton" },
        { "value": "Scheppen" },
        { "value": "Shadowcloak" },
        { "value": "Silverthread" },
        { "value": "Sympony" },
        { "value": "Tarkelby" },
        { "value": "Timbers" },
        { "value": "Turen" },
        { "value": "Umbodoben" },
        { "value": "Waggletop" },
        { "value": "Welber" },
        { "value": "Wildwander" }
      ]
    }]
  }
}
