{
  "init": "format",
  "version": "1.0.0",
  "name": "Dragonborn Name Library",
  "library": true,
  "parts": {
    "format": [{
      "restrictions": {
        "race": [ "dragonborn" ]
      },
      "entries": [
        { "value": "[firstName] of Clan [lastName]", "chance": 20 }
      ]
    }],
    "firstName": [{
      "restrictions": {
        "gender": [ "female" ],
        "race": [ "dragonborn" ]
      },
      "entries": [
        { "value": "Akra" },
        { "value": "Aasathra" },
        { "value": "Antara" },
        { "value": "Arava" },
        { "value": "Biri" },
        { "value": "Blendaeth" },
        { "value": "Burana" },
        { "value": "Chassath" },
        { "value": "Daar" },
        { "value": "Dentratha" },
        { "value": "Doudra" },
        { "value": "Driindar" },
        { "value": "Eggren" },
        { "value": "Farideh" },
        { "value": "Findex" },
        { "value": "Furrele" },
        { "value": "Gesrethe" },
        { "value": "Gilkass" },
        { "value": "Harann" },
        { "value": "Havilar" },
        { "value": "Hethress" },
        { "value": "Hillanot" },
        { "value": "Jaxi" },
        { "value": "Jezean" },
        { "value": "Jheri" },
        { "value": "Kadana" },
        { "value": "Kava" },
        { "value": "Korinn" },
        { "value": "Megren" },
        { "value": "Mijira" },
        { "value": "Mishann" },
        { "value": "Nala" },
        { "value": "Nuthra" },
        { "value": "Perra" },
        { "value": "Pogranix" },
        { "value": "Pyxrin" },
        { "value": "Quespa" },
        { "value": "Raiann" },
        { "value": "Rezena" },
        { "value": "Ruloth" },
        { "value": "Saphara" },
        { "value": "Savaran" },
        { "value": "Sora" },
        { "value": "Surina" },
        { "value": "Synthrin" },
        { "value": "Tatyan" },
        { "value": "Thava" },
        { "value": "Uadjit" },
        { "value": "Vezera" },
        { "value": "Zykroff" }
      ]
    }, {
      "restrictions": {
        "gender": [ "male" ],
        "race": [ "dragonborn" ]
      },
      "entries": [
        { "value": "Adrex" },
        { "value": "Arjhan" },
        { "value": "Azzakh" },
        { "value": "Balasar" },
        { "value": "Baradad" },
        { "value": "Bharash" },
        { "value": "Bidreked" },
        { "value": "Dadalan" },
        { "value": "Dazzazn" },
        { "value": "Direcris" },
        { "value": "Donaar" },
        { "value": "Fax" },
        { "value": "Gargax" },
        { "value": "Ghesh" },
        { "value": "Gorbundus" },
        { "value": "Greethen" },
        { "value": "Heskan" },
        { "value": "Hirrathak" },
        { "value": "Ildrex" },
        { "value": "Kaladan" },
        { "value": "Kerkad" },
        { "value": "Kiirith" },
        { "value": "Kriv" },
        { "value": "Maagog" },
        { "value": "Medrash" },
        { "value": "Mehen" },
        { "value": "Mozikth" },
        { "value": "Mreksh" },
        { "value": "Mugrunden" },
        { "value": "Nadarr" },
        { "value": "Nithther" },
        { "value": "Norkruuth" },
        { "value": "Nykkan" },
        { "value": "Pandjed" },
        { "value": "Patrin" },
        { "value": "Piijink" },
        { "value": "Quarethon" },
        { "value": "Rathkran" },
        { "value": "Rhogar" },
        { "value": "Rivaan" },
        { "value": "Sethrekar" },
        { "value": "Shamash" },
        { "value": "Shedinn" },
        { "value": "Srorthen" },
        { "value": "Tarhun" },
        { "value": "Torinn" },
        { "value": "Trynnicus" },
        { "value": "Valorean" },
        { "value": "Vrondiss" },
        { "value": "Zedaar" }
      ]
    }],
    "lastName": [{
      "restrictions": {
        "race": [ "dragonborn" ]
      },
      "entries": [
        { "value": "Akambherylliax" },
        { "value": "Argenthrixus" },
        { "value": "Baharoosh" },
        { "value": "Beryntolthropal" },
        { "value": "Bhenkumbyrznaax" },
        { "value": "Caavylteradyn" },
        { "value": "Chumbyxirinnish" },
        { "value": "Clethtinthiallor" },
        { "value": "Daardendrian" },
        { "value": "Delmirev" },
        { "value": "Dhyrktelonis" },
        { "value": "Ebynichtomonis" },
        { "value": "Esstyrlynn" },
        { "value": "Fharngnarthnost" },
        { "value": "Ghaallixirn" },
        { "value": "Grrrmmballhyst" },
        { "value": "Gygazzylyshrift" },
        { "value": "Hashphronyxadyn" },
        { "value": "Hshhsstoroth" },
        { "value": "Imbixtellrhyst" },
        { "value": "Jerynomonis" },
        { "value": "Jharthraxyn" },
        { "value": "Kerrhylon" },
        { "value": "Kimbatuul" },
        { "value": "Lhamboldennish" },
        { "value": "Linxakasendalor" },
        { "value": "Mohradyllion" },
        { "value": "Mystan" },
        { "value": "Nemmonis" },
        { "value": "Norixius" },
        { "value": "Ophinshtalajiir" },
        { "value": "Orexijandilin" },
        { "value": "Pfaphnyrennish" },
        { "value": "Phrahdrandon" },
        { "value": "Pyraxtallinost" },
        { "value": "Qyxpahrgh" },
        { "value": "Raghthrknaar" },
        { "value": "Shestendeliath" },
        { "value": "Skaarzborroosh" },
        { "value": "Sumnarghthrysh" },
        { "value": "Tiammanthyllish" },
        { "value": "Turnuroth" },
        { "value": "Umbyrphrael" },
        { "value": "Vangdondalor" },
        { "value": "Verthisathurgiesh" },
        { "value": "Wivvyrholdalphiax" },
        { "value": "Wystongjiir" },
        { "value": "Xephyrbahnor" },
        { "value": "Yarjerit" },
        { "value": "Zzzxaaxthroth" }
      ]
    }]
  }
}
